{
  "schema": 1,
  "id": "body-cut-off-then-ok",
  "tree": "http-basic",
  "routes": [
    {
      "method": "GET",
      "path": "/v2/chtypes/v1/blobs/sha256:c930f836e9b6f6a30f847287b55d9fc039d03eb8d7592f0cc505c7f710c7c76a",
      "responses": [
        {
          "from_tree": true,
          "truncate": 100
        },
        {
          "from_tree": true
        }
      ]
    }
  ],
  "second_origin_routes": []
}
