{
  "schema": 1,
  "id": "tag-410-neither",
  "tree": "revocation",
  "routes": [
    {
      "method": "GET",
      "path": "/v2/chtypes/v1/manifests/26.13.6.1",
      "responses": [
        {
          "status": 410,
          "headers": {
            "Cache-Control": "no-store",
            "Content-Type": "application/json"
          },
          "body": "{\"errors\":[{\"code\":\"DENIED\",\"message\":\"gone\"}]}"
        },
        {
          "from_tree": true
        }
      ]
    }
  ],
  "second_origin_routes": []
}
