{
  "schema": 1,
  "id": "retired-410-no-body",
  "tree": "http-retired",
  "routes": [
    {
      "method": "GET",
      "path": "/v2/chtypes/v1/manifests/26.12",
      "responses": [
        {
          "status": 410,
          "headers": {
            "Cache-Control": "no-store"
          }
        }
      ]
    }
  ],
  "second_origin_routes": []
}
