{
  "schema": 1,
  "id": "retry-408",
  "tree": "http-basic",
  "routes": [
    {
      "method": "GET",
      "path": "/v2/chtypes/v1/manifests/26.12",
      "responses": [
        {
          "status": 408
        },
        {
          "from_tree": true
        }
      ]
    }
  ],
  "second_origin_routes": []
}
