{
  "schema": 1,
  "id": "redirect-cross-origin-drops-auth",
  "tree": "http-basic",
  "routes": [
    {
      "method": "GET",
      "path": "/v2/chtypes/v1/manifests/26.12",
      "responses": [
        {
          "status": 302,
          "headers": {
            "Location": "{second-origin}/v2/s-redirect-cross-origin-drops-auth/chtypes/v1/manifests/26.12"
          }
        }
      ]
    }
  ],
  "second_origin_routes": [
    {
      "method": "GET",
      "path": "/v2/chtypes/v1/manifests/26.12",
      "responses": [
        {
          "from_tree": true
        }
      ]
    }
  ]
}
