{
  "schema": 1,
  "id": "retired-410-blob",
  "tree": "http-retired",
  "routes": [
    {
      "method": "GET",
      "path": "/v2/chtypes/v1/blobs/sha256:c930f836e9b6f6a30f847287b55d9fc039d03eb8d7592f0cc505c7f710c7c76a",
      "responses": [
        {
          "status": 410,
          "headers": {
            "Cache-Control": "no-store",
            "Content-Type": "application/json"
          },
          "body": "{\"errors\":[{\"code\":\"DENIED\",\"message\":\"chtypes/v1 is retired: use chtypes/v2 (this registry no longer serves chtypes/v1)\",\"detail\":{\"retired\":\"chtypes/v1\",\"successor\":\"chtypes/v2\"}}]}"
        },
        {
          "from_tree": true
        }
      ]
    }
  ],
  "second_origin_routes": []
}
